{
  "id": "ub-cal-0007",
  "schema_version": "1.0.0",
  "title": "Calendar workload summarizer",
  "user_goal": "I export my Google Calendar as an .ics file every week and I'd love a little tool I can run that tells me how I'm actually spending my time — like how many hours of meetings I had, which days are busiest, that kind of thing. There's a sample export at env/sample_calendar.ics. Can you build that?",
  "user_goal_persona_note": "Non-expert end user. Describes desired outcomes, not implementation. Will answer clarifying questions in plain language but won't volunteer technical decisions.",
  "domain": "data-analysis",
  "difficulty": "T2",
  "deliverable_type": "cli-tool",
  "required_capabilities": [
    "data-parsing(ics)",
    "datetime-handling",
    "timezone-handling",
    "recurrence-rules",
    "aggregation-stats",
    "arg-parsing",
    "file-io"
  ],
  "accept_threshold": 0.8,
  "contamination_label": "medium",
  "harvest_provenance_id": "hv-2026-06-19-0312",
  "reference_repos": [
    {
      "url": "https://github.com/waldbaer/icalendar-events-cli",
      "commit": "0000000000000000000000000000000000000000",
      "license": "MIT",
      "role": "primary",
      "why": "RFC5545 parsing + filtering + JSON/human output via icalendar + recurring-ical-events; defines defensible field semantics and the 'filter then report' shape. Commit SHA is a placeholder pin; the human freezing the release replaces it with the real harvested HEAD."
    },
    {
      "url": "https://github.com/pimutils/khal",
      "commit": "1111111111111111111111111111111111111111",
      "license": "MIT",
      "role": "secondary",
      "why": "Recurrence expansion + timezone-correctness reference and 'what counts as an event'. Placeholder pin replaced at release-freeze time."
    },
    {
      "url": "https://github.com/loteoo/icsp",
      "commit": "2222222222222222222222222222222222222222",
      "license": "Unlicense",
      "role": "inspiration",
      "why": "ics->tabular reduction supporting the 'turn the calendar into rows, then aggregate' framing; minimal-dependency path. Placeholder pin replaced at release-freeze time."
    }
  ],
  "env": {
    "dockerfile": "env/Dockerfile",
    "base_image": "python:3.11-slim",
    "network": "deny",
    "allowlist": [],
    "fixtures": [
      "env/sample_calendar.ics"
    ],
    "allowed_reqs": [
      "icalendar>=5.0,<7.0",
      "recurring-ical-events>=2.1,<4.0",
      "python-dateutil>=2.8,<3.0",
      "tzdata>=2024.1"
    ],
    "setup": [
      "pip install -r env/requirements.allowed.txt"
    ],
    "entrypoint_hint": null
  },
  "expected_interventions": {
    "median": 3,
    "p10": 1,
    "p90": 6,
    "by_type": {
      "clarification": 2,
      "hint": 1,
      "rescue": 0
    },
    "calibrated_with": "PLACEHOLDER: filled after pilot (1 Claude + 1 OpenAI + 1 open-weight via vLLM, 5 trials each); see docs/tasks.md §6.4.",
    "discriminative": true
  },
  "hidden": {
    "summary": "Build a CLI that reads one or more .ics exports, expands recurring (RRULE) events within the analysis window, normalizes every event to a single report timezone before aggregating, and reports: total events, total scheduled hours, mean/median event duration, a per-weekday hour distribution with the busiest day, and a meeting-vs-non-meeting split. All-day events are counted as events but excluded from hour totals (reported separately). STATUS:CANCELLED events are excluded entirely.",
    "oracle_persona": "non_expert_user",
    "acceptance_criteria": [
      {
        "id": "AC1",
        "text": "Parses a valid RFC5545 .ics and runs to completion without crashing on env/sample_calendar.ics.",
        "weight": 1.0,
        "is_core": true,
        "is_hard": true,
        "check_kind": "func",
        "check_ref": "grader/grade.py::AC1",
        "source": "reference_repos[0] README invocation examples"
      },
      {
        "id": "AC2",
        "text": "Total scheduled hours within ±2% of gold (7.0h) for the sample calendar.",
        "weight": 2.0,
        "is_core": true,
        "is_hard": false,
        "check_kind": "func",
        "check_ref": "grader/grade.py::AC2",
        "source": "gold/cal_summary_gold.json::totals.total_scheduled_hours"
      },
      {
        "id": "AC3",
        "text": "Recurring events are expanded across the window so the reported event count matches gold exactly (the weekly standup RRULE expands to 4 occurrences; total event_count == 9).",
        "weight": 2.0,
        "is_core": true,
        "is_hard": false,
        "check_kind": "func",
        "check_ref": "grader/grade.py::AC3",
        "source": "gold/cal_summary_gold.json::totals.event_count"
      },
      {
        "id": "AC4",
        "text": "All-day events (the PTO block) are excluded from the hour total and surfaced as a separate count.",
        "weight": 1.0,
        "is_core": false,
        "is_hard": false,
        "check_kind": "func",
        "check_ref": "grader/grade.py::AC4",
        "source": "gold/cal_summary_gold.json::totals.allday_event_count"
      },
      {
        "id": "AC5",
        "text": "All event times are normalized to a single report timezone before weekday bucketing (property probe: the New-York-scheduled review must land on Thursday in Europe/Amsterdam, not Wednesday).",
        "weight": 1.5,
        "is_core": true,
        "is_hard": false,
        "check_kind": "func",
        "check_ref": "grader/probes/tz_probe.py",
        "source": "gold/cal_summary_gold.json::busiest_day (TZ-sensitive)"
      },
      {
        "id": "AC6",
        "text": "STATUS:CANCELLED events are excluded entirely (including the cancelled 1h vendor sync would push hours to 8.0, beyond the ±2% tolerance).",
        "weight": 1.0,
        "is_core": false,
        "is_hard": false,
        "check_kind": "func",
        "check_ref": "grader/grade.py::AC6",
        "source": "gold/cal_summary_gold.json::totals.cancelled_excluded_count"
      },
      {
        "id": "AC7",
        "text": "Exposes --help with a documented usage/invocation string.",
        "weight": 0.5,
        "is_core": false,
        "is_hard": false,
        "check_kind": "func",
        "check_ref": "grader/grade.py::AC7",
        "source": "usability convention (argparse/click --help)"
      },
      {
        "id": "AC8",
        "text": "Reports the correct busiest weekday (Thu, 3.0h) — jointly verifies recurrence expansion and timezone normalization.",
        "weight": 1.0,
        "is_core": true,
        "is_hard": false,
        "check_kind": "func",
        "check_ref": "grader/grade.py::AC8",
        "source": "gold/cal_summary_gold.json::busiest_day.weekday"
      }
    ],
    "ambiguity_points": [
      {
        "id": "AP1",
        "question": "Should recurring events be expanded into each occurrence, or counted once?",
        "gold": "Expanded: count each occurrence that falls within the analysis window.",
        "reveal": "on_ask",
        "severity": "high"
      },
      {
        "id": "AP2",
        "question": "What timezone should the hours be reported in?",
        "gold": "Normalize to the calendar's primary timezone (Europe/Amsterdam here); allow a --tz override.",
        "reveal": "on_ask",
        "severity": "high"
      },
      {
        "id": "AP3",
        "question": "Should all-day events (e.g. PTO/vacation) count toward the hour total?",
        "gold": "No. Exclude them from hours; report them separately as a count.",
        "reveal": "on_ask",
        "severity": "medium"
      },
      {
        "id": "AP4",
        "question": "How is a 'meeting' defined versus another kind of event?",
        "gold": ">=2 distinct attendees OR the event has a conferencing URL; otherwise it is a non-meeting (e.g. a solo focus block).",
        "reveal": "on_ask",
        "severity": "medium"
      },
      {
        "id": "AP5",
        "question": "What output format is expected — a text table, JSON, or a chart?",
        "gold": "A human-readable summary by default is fine; a --json flag is a nice-to-have. The grader accepts either.",
        "reveal": "on_ask",
        "severity": "low"
      },
      {
        "id": "AP6",
        "question": "What analysis window should be used?",
        "gold": "The full span of the file unless --from/--to are given.",
        "reveal": "on_ask",
        "severity": "medium"
      }
    ],
    "info_units": [
      {
        "id": "req:expand-recurring",
        "class": "requirement",
        "desc": "Recurring (RRULE) events must be expanded to each occurrence in the window."
      },
      {
        "id": "req:normalize-tz",
        "class": "requirement",
        "desc": "All times normalized to one report timezone before weekday aggregation."
      },
      {
        "id": "req:exclude-allday-hours",
        "class": "requirement",
        "desc": "All-day events excluded from hour totals; counted separately."
      },
      {
        "id": "req:exclude-cancelled",
        "class": "constraint",
        "desc": "STATUS:CANCELLED events excluded from every total."
      },
      {
        "id": "req:meeting-heuristic",
        "class": "requirement",
        "desc": "Meeting := >=2 attendees OR has a conferencing URL."
      },
      {
        "id": "pref:report-fields",
        "class": "preference",
        "desc": "Report total events, total hours, mean/median duration, per-weekday distribution, busiest day, meeting split."
      },
      {
        "id": "pref:tz-override",
        "class": "preference",
        "desc": "Provide a --tz override for the report timezone."
      },
      {
        "id": "pref:window-override",
        "class": "preference",
        "desc": "Provide --from/--to to bound the analysis window; default to full file span."
      }
    ],
    "reveal_rules": {
      "AP1": "on_ask",
      "AP2": "on_ask",
      "AP3": "on_ask",
      "AP4": "on_ask",
      "AP5": "on_ask",
      "AP6": "on_ask"
    },